{
  "spec_version": "1.0",
  "intent_id": "01J0000000000000000000FZ01",
  "idempotency_key": "fuzz-valid-seed",
  "created_at": "2026-08-08T12:00:00.000Z",
  "expires_at": "2026-08-08T12:05:00.000Z",
  "principal": {
    "organization_id": "alpha-lab",
    "agent_id": "research-agent-01"
  },
  "mandate": {
    "mandate_id": "mandate-fuzz",
    "purpose": "seed the public Intent parser",
    "human_authorized": true
  },
  "action": {
    "category": "payment",
    "operation": "purchase_api_resource"
  },
  "resource": {
    "protocol": "x402",
    "resource_id": "dataset-fuzz",
    "resource_type": "dataset"
  },
  "transaction": {
    "network": "eip155:8453",
    "asset": "eip155:8453/erc20:0x833589fcd6edb6e08f4c7c32d4f71b54bda02913",
    "amount": "12.50",
    "destination": "eip155:8453:0x1111111111111111111111111111111111111111"
  },
  "context": {},
  "metadata": {}
}
